{
  "schema_version": 3,
  "project": "",
  "state": {
    "problem": {
      "status": "pending"
    },
    "questions": {
      "Q001": {
        "status": "validated",
        "models": [],
        "experiments": [
          "E001"
        ],
        "claims": [
          "C001"
        ],
        "dependencies": [],
        "retry_count": 0,
        "failure_reason": null,
        "last_updated": "2026-09-06T05:31:28+00:00"
      },
      "Q002": {
        "status": "validated",
        "models": [],
        "experiments": [
          "E002"
        ],
        "claims": [
          "C002"
        ],
        "dependencies": [],
        "retry_count": 0,
        "failure_reason": null,
        "last_updated": "2026-09-06T05:31:28+00:00"
      },
      "Q003": {
        "status": "validated",
        "models": [],
        "experiments": [
          "E003"
        ],
        "claims": [
          "C003"
        ],
        "dependencies": [],
        "retry_count": 0,
        "failure_reason": null,
        "last_updated": "2026-09-06T05:31:28+00:00"
      },
      "Q004": {
        "status": "validated",
        "models": [],
        "experiments": [
          "E004"
        ],
        "claims": [
          "C004"
        ],
        "dependencies": [],
        "retry_count": 0,
        "failure_reason": null,
        "last_updated": "2026-09-06T05:31:28+00:00"
      }
    },
    "models": {
      "status": "pending",
      "candidates": [
        "M001",
        "M002",
        "M003",
        "M004"
      ],
      "selected": []
    },
    "experiments": {
      "status": "pending",
      "by_question": {}
    },
    "evidence": {
      "status": "pending",
      "graph_version": 1,
      "claims_supported": 4,
      "claims_total": 4,
      "coverage_ratio": 1.0
    },
    "narrative": {
      "status": "pending"
    },
    "paper": {
      "status": "pending",
      "sections_written": 0,
      "sections_total": 0
    },
    "review": {
      "status": "pending",
      "rounds_completed": 0,
      "verdict": null
    }
  },
  "workflow": {
    "current_nodes": [],
    "completed_nodes": [],
    "blocked_nodes": [],
    "waiting_approval": [],
    "retries": {},
    "notes": []
  },
  "run": {
    "phase": "init",
    "started_at": "2026-09-06T05:31:28+00:00",
    "updated_at": "2026-09-06T05:31:28+00:00"
  }
}